[
  {
    "history_id": "a21e6acf-b7ad-5e60-940c-26801aa5b24f",
    "inquiry_id": "f72a3b18-a4f8-5f5e-8c86-199ffc1d8aa2",
    "sequence": 1,
    "event": "START_INQUIRY",
    "from_status": null,
    "to_status": "DRAFT",
    "actor_role": "CUSTOMER",
    "actor_id": "2fdda38e-2530-5d2d-b0ad-97630b3b5c3e",
    "assigned_role_after": "NONE",
    "assigned_user_id_after": null,
    "state_version": 1,
    "idempotency_key": "idem-SYN-JAC104-001-01",
    "correlation_id": "ce49a0ed-c435-5efe-b0d3-06b97f4f7083",
    "changed_at": "2026-07-01T15:00:00+09:00",
    "reason": "SYN-JAC104-001 합성 상태 전이",
    "data_classification": "synthetic"
  },
  {
    "history_id": "99e2493e-c58b-58a0-8c19-f8ba44d4d8ff",
    "inquiry_id": "f72a3b18-a4f8-5f5e-8c86-199ffc1d8aa2",
    "sequence": 2,
    "event": "SUBMIT_SYMPTOM",
    "from_status": "DRAFT",
    "to_status": "QUESTIONNAIRE_IN_PROGRESS",
    "actor_role": "CUSTOMER",
    "actor_id": "2fdda38e-2530-5d2d-b0ad-97630b3b5c3e",
    "assigned_role_after": "NONE",
    "assigned_user_id_after": null,
    "state_version": 2,
    "idempotency_key": "idem-SYN-JAC104-001-02",
    "correlation_id": "ce49a0ed-c435-5efe-b0d3-06b97f4f7083",
    "changed_at": "2026-07-01T15:30:00+09:00",
    "reason": "SYN-JAC104-001 합성 상태 전이",
    "data_classification": "synthetic"
  },
  {
    "history_id": "343186ef-ace2-5609-919c-9b55361a2840",
    "inquiry_id": "bcb70ef6-01ac-5e0e-8a8d-fe5af43e8bde",
    "sequence": 1,
    "event": "START_INQUIRY",
    "from_status": null,
    "to_status": "DRAFT",
    "actor_role": "CUSTOMER",
    "actor_id": "18b30d13-a38b-5035-84b3-988406079e0d",
    "assigned_role_after": "NONE",
    "assigned_user_id_after": null,
    "state_version": 1,
    "idempotency_key": "idem-SYN-JAC104-002-01",
    "correlation_id": "e5a21d79-f423-5795-aae1-10a5ba772937",
    "changed_at": "2026-07-01T21:00:00+09:00",
    "reason": "SYN-JAC104-002 합성 상태 전이",
    "data_classification": "synthetic"
  },
  {
    "history_id": "35cf2759-e4ab-5a35-b1f4-88c9a5a61cb6",
    "inquiry_id": "bcb70ef6-01ac-5e0e-8a8d-fe5af43e8bde",
    "sequence": 2,
    "event": "SUBMIT_SYMPTOM",
    "from_status": "DRAFT",
    "to_status": "QUESTIONNAIRE_IN_PROGRESS",
    "actor_role": "CUSTOMER",
    "actor_id": "18b30d13-a38b-5035-84b3-988406079e0d",
    "assigned_role_after": "NONE",
    "assigned_user_id_after": null,
    "state_version": 2,
    "idempotency_key": "idem-SYN-JAC104-002-02",
    "correlation_id": "e5a21d79-f423-5795-aae1-10a5ba772937",
    "changed_at": "2026-07-01T21:30:00+09:00",
    "reason": "SYN-JAC104-002 합성 상태 전이",
    "data_classification": "synthetic"
  },
  {
    "history_id": "462f1844-20a5-5a7e-bc75-d433bda7da4b",
    "inquiry_id": "bcb70ef6-01ac-5e0e-8a8d-fe5af43e8bde",
    "sequence": 3,
    "event": "SUBMIT_ANSWERS",
    "from_status": "QUESTIONNAIRE_IN_PROGRESS",
    "to_status": "QUESTIONNAIRE_IN_PROGRESS",
    "actor_role": "CUSTOMER",
    "actor_id": "18b30d13-a38b-5035-84b3-988406079e0d",
    "assigned_role_after": "NONE",
    "assigned_user_id_after": null,
    "state_version": 3,
    "idempotency_key": "idem-SYN-JAC104-002-03",
    "correlation_id": "e5a21d79-f423-5795-aae1-10a5ba772937",
    "changed_at": "2026-07-01T22:00:00+09:00",
    "reason": "SYN-JAC104-002 합성 상태 전이",
    "data_classification": "synthetic"
  },
  {
    "history_id": "a16516b7-66d8-5e5f-be17-e1a8ec5b1cf0",
    "inquiry_id": "bcb70ef6-01ac-5e0e-8a8d-fe5af43e8bde",
    "sequence": 4,
    "event": "SAFE_GUIDANCE_READY",
    "from_status": "QUESTIONNAIRE_IN_PROGRESS",
    "to_status": "AI_GUIDANCE_READY",
    "actor_role": "SYSTEM",
    "actor_id": null,
    "assigned_role_after": "NONE",
    "assigned_user_id_after": null,
    "state_version": 4,
    "idempotency_key": "idem-SYN-JAC104-002-04",
    "correlation_id": "e5a21d79-f423-5795-aae1-10a5ba772937",
    "changed_at": "2026-07-01T22:30:00+09:00",
    "reason": "SYN-JAC104-002 합성 상태 전이",
    "data_classification": "synthetic"
  },
  {
    "history_id": "8eae4b9a-06a3-5d12-942b-bf75ea8d4c15",
    "inquiry_id": "bcb70ef6-01ac-5e0e-8a8d-fe5af43e8bde",
    "sequence": 5,
    "event": "REQUEST_CONSULTATION",
    "from_status": "AI_GUIDANCE_READY",
    "to_status": "CONSULTATION_PENDING",
    "actor_role": "CUSTOMER",
    "actor_id": "18b30d13-a38b-5035-84b3-988406079e0d",
    "assigned_role_after": "NONE",
    "assigned_user_id_after": null,
    "state_version": 5,
    "idempotency_key": "idem-SYN-JAC104-002-05",
    "correlation_id": "e5a21d79-f423-5795-aae1-10a5ba772937",
    "changed_at": "2026-07-01T23:00:00+09:00",
    "reason": "SYN-JAC104-002 합성 상태 전이",
    "data_classification": "synthetic"
  },
  {
    "history_id": "6e207f99-005a-5f34-a377-a8db6eb288fc",
    "inquiry_id": "bcb70ef6-01ac-5e0e-8a8d-fe5af43e8bde",
    "sequence": 6,
    "event": "START_CONSULTATION",
    "from_status": "CONSULTATION_PENDING",
    "to_status": "CONSULTATION_IN_PROGRESS",
    "actor_role": "COUNSELOR",
    "actor_id": "9791249c-4e86-539c-8c50-b8d02c3fc57f",
    "assigned_role_after": "COUNSELOR",
    "assigned_user_id_after": "9791249c-4e86-539c-8c50-b8d02c3fc57f",
    "state_version": 6,
    "idempotency_key": "idem-SYN-JAC104-002-06",
    "correlation_id": "e5a21d79-f423-5795-aae1-10a5ba772937",
    "changed_at": "2026-07-01T23:30:00+09:00",
    "reason": "SYN-JAC104-002 합성 상태 전이",
    "data_classification": "synthetic"
  },
  {
    "history_id": "50e3d077-5caa-543f-87e6-2c00fc9cba4a",
    "inquiry_id": "bcb70ef6-01ac-5e0e-8a8d-fe5af43e8bde",
    "sequence": 7,
    "event": "VISIT_NEEDED",
    "from_status": "CONSULTATION_IN_PROGRESS",
    "to_status": "VISIT_REVIEW_PENDING",
    "actor_role": "COUNSELOR",
    "actor_id": "9791249c-4e86-539c-8c50-b8d02c3fc57f",
    "assigned_role_after": "COUNSELOR",
    "assigned_user_id_after": "9791249c-4e86-539c-8c50-b8d02c3fc57f",
    "state_version": 7,
    "idempotency_key": "idem-SYN-JAC104-002-07",
    "correlation_id": "e5a21d79-f423-5795-aae1-10a5ba772937",
    "changed_at": "2026-07-02T00:00:00+09:00",
    "reason": "SYN-JAC104-002 합성 상태 전이",
    "data_classification": "synthetic"
  },
  {
    "history_id": "13febe5a-86eb-5b6c-aa86-e8eb5a3d421c",
    "inquiry_id": "bcb70ef6-01ac-5e0e-8a8d-fe5af43e8bde",
    "sequence": 8,
    "event": "CONFIRM_VISIT",
    "from_status": "VISIT_REVIEW_PENDING",
    "to_status": "VISIT_PENDING",
    "actor_role": "COUNSELOR",
    "actor_id": "9791249c-4e86-539c-8c50-b8d02c3fc57f",
    "assigned_role_after": "TECHNICIAN",
    "assigned_user_id_after": "c2bafcaf-b050-5388-8c90-03367c0e34e8",
    "state_version": 8,
    "idempotency_key": "idem-SYN-JAC104-002-08",
    "correlation_id": "e5a21d79-f423-5795-aae1-10a5ba772937",
    "changed_at": "2026-07-02T00:30:00+09:00",
    "reason": "SYN-JAC104-002 합성 상태 전이",
    "data_classification": "synthetic"
  },
  {
    "history_id": "369a811c-0627-52f9-94b4-570ed020c290",
    "inquiry_id": "bcb70ef6-01ac-5e0e-8a8d-fe5af43e8bde",
    "sequence": 9,
    "event": "START_VISIT",
    "from_status": "VISIT_PENDING",
    "to_status": "VISIT_IN_PROGRESS",
    "actor_role": "TECHNICIAN",
    "actor_id": "c2bafcaf-b050-5388-8c90-03367c0e34e8",
    "assigned_role_after": "TECHNICIAN",
    "assigned_user_id_after": "c2bafcaf-b050-5388-8c90-03367c0e34e8",
    "state_version": 9,
    "idempotency_key": "idem-SYN-JAC104-002-09",
    "correlation_id": "e5a21d79-f423-5795-aae1-10a5ba772937",
    "changed_at": "2026-07-04T00:00:00+09:00",
    "reason": "SYN-JAC104-002 합성 상태 전이",
    "data_classification": "synthetic"
  },
  {
    "history_id": "b6c3af95-2cda-58d0-b85d-38b5112bf1de",
    "inquiry_id": "bcb70ef6-01ac-5e0e-8a8d-fe5af43e8bde",
    "sequence": 10,
    "event": "VISIT_COMPLETED",
    "from_status": "VISIT_IN_PROGRESS",
    "to_status": "COMPLETION_PENDING",
    "actor_role": "TECHNICIAN",
    "actor_id": "c2bafcaf-b050-5388-8c90-03367c0e34e8",
    "assigned_role_after": "TECHNICIAN",
    "assigned_user_id_after": "c2bafcaf-b050-5388-8c90-03367c0e34e8",
    "state_version": 10,
    "idempotency_key": "idem-SYN-JAC104-002-10",
    "correlation_id": "e5a21d79-f423-5795-aae1-10a5ba772937",
    "changed_at": "2026-07-04T01:00:00+09:00",
    "reason": "SYN-JAC104-002 합성 상태 전이",
    "data_classification": "synthetic"
  },
  {
    "history_id": "bece1884-e891-5893-ab4a-028b08b725f6",
    "inquiry_id": "bcb70ef6-01ac-5e0e-8a8d-fe5af43e8bde",
    "sequence": 11,
    "event": "SUBMIT_RESOLUTION_FEEDBACK",
    "from_status": "COMPLETION_PENDING",
    "to_status": "COMPLETION_PENDING",
    "actor_role": "CUSTOMER",
    "actor_id": "18b30d13-a38b-5035-84b3-988406079e0d",
    "assigned_role_after": "TECHNICIAN",
    "assigned_user_id_after": "c2bafcaf-b050-5388-8c90-03367c0e34e8",
    "state_version": 11,
    "idempotency_key": "idem-SYN-JAC104-002-11",
    "correlation_id": "e5a21d79-f423-5795-aae1-10a5ba772937",
    "changed_at": "2026-07-04T03:00:00+09:00",
    "reason": "SYN-JAC104-002 합성 상태 전이",
    "data_classification": "synthetic"
  },
  {
    "history_id": "001cb2dd-2ade-5657-93aa-2b5d95e254e6",
    "inquiry_id": "bcb70ef6-01ac-5e0e-8a8d-fe5af43e8bde",
    "sequence": 12,
    "event": "FINALIZE_INQUIRY",
    "from_status": "COMPLETION_PENDING",
    "to_status": "RESOLVED",
    "actor_role": "TECHNICIAN",
    "actor_id": "c2bafcaf-b050-5388-8c90-03367c0e34e8",
    "assigned_role_after": "TECHNICIAN",
    "assigned_user_id_after": "c2bafcaf-b050-5388-8c90-03367c0e34e8",
    "state_version": 12,
    "idempotency_key": "idem-SYN-JAC104-002-12",
    "correlation_id": "e5a21d79-f423-5795-aae1-10a5ba772937",
    "changed_at": "2026-07-04T03:30:00+09:00",
    "reason": "SYN-JAC104-002 합성 상태 전이",
    "data_classification": "synthetic"
  },
  {
    "history_id": "aeb7414d-69e4-579b-868e-9d25614bc57d",
    "inquiry_id": "91a8cf0c-9139-5d17-a6bd-818eb9aa7585",
    "sequence": 1,
    "event": "START_INQUIRY",
    "from_status": null,
    "to_status": "DRAFT",
    "actor_role": "CUSTOMER",
    "actor_id": "cbfd135a-ae43-51a6-88a6-2ef6635aee6c",